,0
0,A first in Europe: Dutch football players agree to pay cuts of up to 20%
1,Dutch demand solidarity in corona rules
2,Dutch can postpone organ donation choice
3,Covid-19 vaccine key to major events
4,Face masks and tests: the Dutch approach
5,KLM lost €1.8bn in Q1
6,Coronavirus crisis scuppers holiday plans
7,Dutch Eredivisie players are worth less
8,Gyms furious they can't reopen
9,
10,A first in Europe: Dutch football players agree to pay cuts of up to 20%
11,Government restrictions are having a clear impact on virus spread: RIVM
12,Relaxing coronavirus rules must not hit health service: survey
13,Coronavirus leads to delay in 'opt out' organ donation programme
14,Major festivals not on the calendar until Covid-19 vaccine is ready
15,"Face masks, testing and an app: what the Dutch are doing"
16,"MPs back support for flag carrier KLM, which lost €1.8bn in Q1"
17,Coronavirus crisis scuppers holiday plans for millions
18,Coronavirus and season cancellation hits Eredivisie player values
19,"Gyms furious they can't reopen, call for government rethink"
20,Bol.com sales soar 40% in Q1 as consumers move online
21,"Dutch start easing coronavirus restrictions, face masks a must on public transport"
22,All eyes on Mark Rutte ahead of potential Dutch exit strategy
23,"Dutch coronavirus deaths decline again, 36 new deaths reported"
24,Coronovirus in the Netherlands: your personal stories
25,Organ transplants down 60% due to coronavirus restrictions
26,Dutch biotech firm Inzek accused of rebranding 'unreliable' corona tests
27,"Cultural landscape will turn into 'wasteland' without more support, say museum chiefs"
28,Dutch have one million tests to check for coronavirus immunity
29,Coronvirus in the Netherlands: what you said in our survey
